img	comment	related text	question	answer
		The painting shows Monsieur and Madame Guillemet, Manet's close friends, who ran a ` haute couture ' salon in the faubourg Saint-Honor in Paris.	Whose close friends is Monsieur and Madame Guillemet?	Manet's close friends
37464-woodedla.jpg	This canvas shows a wooded landscape with a country house, classical ruins on a distant hill, and three travellers resting in the foregroun			
		This canvas shows a wooded landscape with a country house, classical ruins on a distant hill, and three travellers resting in the foregroun	What shows a wooded landscape with a country house?	this canvas
		This canvas shows a wooded landscape with a country house, classical ruins on a distant hill, and three travellers resting in the foregroun	What is classical ruins on a distant hill, and three travellers resting in the foregroun?	the country house
		This canvas shows a wooded landscape with a country house, classical ruins on a distant hill, and three travellers resting in the foregroun	What is the country house?	classical ruins on a distant hill, and three travellers resting in the foregroun
00893-20east.jpg	This scene is the left half the lunette on the east wall.			
		This scene is the left half the lunette on the east wall.	What is the left half the lunette on the east wall?	this scene
23612-1bacchan.jpg	The painting belongs to a series of four, two of which representing bacchanalian scenes, the other two brigands. In the 18th century all four was in the collection of the Russian Count Suvalov, then in the 20th century it was tranferred to the Hermitage. (One of the bacchanalian scenes is now in the Pushkin Museum, Moscow.)The painting was executed in collaboration with Clemente Spera who painted the architectural background.			
		(One of the bacchanalian scenes is now in the Pushkin Museum, Moscow. )	What is (One of the bacchanalian scenes now in? )	in the Pushkin Museum
		The painting was executed in collaboration with Clemente Spera who painted the architectural background.	What was the painting executed in?	in collaboration with Clemente Spera who painted the architectural background
		The painting was executed in collaboration with Clemente Spera who painted the architectural background.	What was executed in collaboration with Clemente Spera who painted the architectural background?	the painting
		In the 18th century all four was in the collection of the Russian Count Suvalov, then in the 20th century it was tranferred to the Hermitage.	What was in the collection of the Russian Count Suvalov?	all four
		The painting belongs to a series of four, two of which representing bacchanalian scenes, the other two brigands.	What does the painting belong to?	to a series of four
		(One of the bacchanalian scenes is now in the Pushkin Museum, Moscow. )	What is Moscow?	the Pushkin Museum
14035-1stephen.jpg	"The panel constitutes one wing of a polyptych. Another wing representing St Michael Archangel is also in The Hermitage.The inscription on the halo can be read as ""Sanctus Stefanus Protomartirus"". The visage of the saints shows similarities to those of other Foppa representations"			
		``The panel constitutes one wing of a polyptych.	What does the panel constitute?	one wing of a polyptych
		The inscription on the halo can be read as'' ``Sanctus Stefanus Protomartirus''''.	What can be read as ``Sanctus Stefanus Protomartirus''''?	the inscription on the halo
		Another wing representing St Michael Archangel is also in The Hermitage.	What is also in The Hermitage?	another wing representing St Michael Archangel
		Another wing representing St Michael Archangel is also in The Hermitage.	What is another wing representing St Michael Archangel also in?	in The Hermitage
		The visage of the saints shows similarities to those of other Foppa representations''	What does the visage of the saints show?	similarities to those of other Foppa representations
		``The panel constitutes one wing of a polyptych.	What constitutes one wing of a polyptych?	the panel
17823-807goya.jpg	The painting was formerly in the collection of Goya's grandson, Mariano, and before it was relined the canvas was inscribed on the back: 'El celebre ciego fijo' ('The famous blind man'). The sitter was identified as a well-known beggar who used to sit on the steps of the church of San Felipe el Real in Madrid, and was invited to play the guitar and sing in the houses of members of the court.Goya creates a vivid impression of the blind eyes and jovial expression of the old man in a style close to that of the 'black paintings'. At the same time it is remarkably similar to the manner of Vel�zquez in his portrayal of the facial expressions of court dwarfs			
		At the same time it is remarkably similar to the manner of Velzquez in his portrayal of the facial expressions of court dwarfs	What is remarkably similar to the manner of Velzquez in his portrayal of the facial expressions of court dwarfs at the same time?	a vivid impression of the blind eyes and jovial expression of the old man in a style close to that of the ` black paintings '
		Goya creates a vivid impression of the blind eyes and jovial expression of the old man in a style close to that of the ` black paintings '.	What does Goya create?	a vivid impression of the blind eyes and jovial expression of the old man in a style close to that of the ` black paintings '
		Goya creates a vivid impression of the blind eyes and jovial expression of the old man in a style close to that of the ` black paintings '.	What does Goya create a vivid impression of?	of the blind eyes and jovial expression of the old man in a style close to that of the ` black paintings '
13303-04church.jpg	The figure of the Madonna, represented in supernatural size standing in the nave of a Gothic church, alludes to the fact that the mother of Christ has often been described as a 'templum' or 'domus dei' since Christ, during his incarnation, lived in her as in a temple.The asymmetric composition, unusual at Van Eyck, is explained by the fact that this panel was the left wing of a diptych. The other wing is lost but contemporary copies prove the correctness of this assumption			
		The asymmetric composition, unusual at Van Eyck, is explained by the fact that this panel was the left wing of a diptych.	What is the asymmetric composition explained by?	by the fact that this panel was the left wing of a diptych
		The other wing is lost but contemporary copies prove the correctness of this assumption	What do contemporary copies prove the correctness of?	of this assumption
		The other wing is lost but contemporary copies prove the correctness of this assumption	What is lost?	the other wing
		The other wing is lost but contemporary copies prove the correctness of this assumption	What do contemporary copies prove?	the correctness of this assumption
25148-panel2.jpg	Two panels in the Kunsthaus, Zurich, depicting The Annunciation and The Nativity, are thought to have constituted part of the wings of a large Crucifixion altarpiece whose central panel was the Munich Cathedral Crucifixion (M�nchner Domkreuzigung) now in that city's Frauenkirche. which in turn is considered the work of a collaborator dubbed the Master of the Munich Cathedral Crucifixion			
39789-14franci.jpg	Titian never saw Francis I, the king of France (1494&#151;1547). He nonetheless succeeded in painting an impressive portrait of a ruler. The model for his portrait was a medal made by Benvenuto Cellini, showing the king in profile. The erect posture, broad torso and magnificent garments give the portrait a regal air. The flat hat with its delicate feathers, together with his fine hair, which is brushed across his face in a similarly feathery way, give a certain lightness to the otherwise very proud royal portrait			
		The model for his portrait was a medal made by Benvenuto Cellini, showing the king in profile.	What did the model for Titian's portrait show the king in?	in profile
		The flat hat with its delicate feathers, together with his fine hair, which is brushed across his face in a similarly feathery way, give a certain lightness to the otherwise very proud royal portrait	What is the flat hat with a regal air's delicate feathers, together with Titian's fine hair brushed across his face in?	in a similarly feathery way
		The model for his portrait was a medal made by Benvenuto Cellini, showing the king in profile.	What was a medal made by Benvenuto Cellini?	the model for Titian's portrait
		The flat hat with its delicate feathers, together with his fine hair, which is brushed across his face in a similarly feathery way, give a certain lightness to the otherwise very proud royal portrait	What is brushed across his face in a similarly feathery way?	the flat hat with a regal air's delicate feathers, together with Titian's fine hair
		The flat hat with its delicate feathers, together with his fine hair, which is brushed across his face in a similarly feathery way, give a certain lightness to the otherwise very proud royal portrait	What do the flat hat with a regal air's delicate feathers, together with Titian's fine hair give to the otherwise very proud royal portrait?	a certain lightness
		The flat hat with its delicate feathers, together with his fine hair, which is brushed across his face in a similarly feathery way, give a certain lightness to the otherwise very proud royal portrait	What give a certain lightness to the otherwise very proud royal portrait?	the flat hat with a regal air's delicate feathers, together with Titian's fine hair
03629-stirling.jpg	Margaret Stirling (died 1849) was the daughter of Sir William Stirling, 4th Baronet of Ardoch (c. 1730-1799) and his wife Christian Erskine			
		Margaret Stirling (died 1849) was the daughter of Sir William Stirling, 4th Baronet of Ardoch (c. 1730-1799) and his wife Christian Erskine	Who was Margaret Stirling?	the daughter of Sir William Stirling, 4th Baronet of Ardoch and his wife Christian Erskine
		Margaret Stirling (died 1849) was the daughter of Sir William Stirling, 4th Baronet of Ardoch (c. 1730-1799) and his wife Christian Erskine	Who was Margaret Stirling the daughter of?	of Sir William Stirling, 4th Baronet of Ardoch and his wife Christian Erskine
		Margaret Stirling (died 1849) was the daughter of Sir William Stirling, 4th Baronet of Ardoch (c. 1730-1799) and his wife Christian Erskine	Who was the daughter of Sir William Stirling, 4th Baronet of Ardoch and his wife Christian Erskine?	Margaret Stirling
30603-2mira01.jpg	Toward the end of the seventeenth century, Cesare Alessandri, a wealthy Venetian merchant had a wing erected to the side of his villa, to be used as foresteria (guest quarters). Decorations embellish three rooms on the second floor; the paintings in the central hall and in the northwest room are attributed to Giovanni Antonio Pellegrini. The fresco cycles in these two rooms constitute the first private fresco commission given to Pellegrini after his return to Venice from Rome. His stay in Rome had been beneficial to his development, enabling him to incorporate into his own visual repertory the language of Luca Giordano and Baciccio.In the central hall, within faux-stucco frames, are depictions of mythological scenes inspired by Ovid's Metamorphoses. The frescoes are located within vertical compartments of various sizes on the walls of the hall, which, because of its elongated shape, seems almost like a gallery. The light is diffused through three large, arched windows. The windowed wall contains the paintings Apollo and Daphne, Sleeping Endymion, Salmacis and the Hermaphrodite, and Cadmus Sowing the Dragons Teeth. The two short walls have the Rape of Deianira and Narcissus at the Spring on one side, and the Rape of Europa and on the other. Mercury and Argus. The entrance wall has the representations Dana&#235; and the Shower of Gold, Venus Weeping over the Death of Adonis, and Pan and Syrinx.Above, a painted frieze of interwoven laurel leaves circle the perimeter of the room. Perched atop the frieze, are child musicians, parrots, squirrels, and little monkeys. The decorative program is completed on the curvature of the ceiling, where eight inserts depict putti and little satyrs at play. On the vault are three coffers in which the frescoes for the most part faded away			
		His stay in Rome had been beneficial to his development, enabling him to incorporate into his own visual repertory the language of Luca Giordano and Baciccio.	Who did Giovanni Antonio Pellegrini's stay in Rome enable him to incorporate into his own visual repertory the language of?	of Luca Giordano and Baciccio
		The windowed wall contains the paintings Apollo and Daphne, Sleeping Endymion, Salmacis and the Hermaphrodite, and Cadmus Sowing the Dragons Teeth.	What does the windowed wall contain?	the paintings Apollo and Daphne
		Toward the end of the seventeenth century, Cesare Alessandri, a wealthy Venetian merchant had a wing erected to the side of his villa, to be used as foresteria (guest quarters).	Who was Cesare Alessandri?	a wealthy Venetian merchant
		The windowed wall contains the paintings Apollo and Daphne, Sleeping Endymion, Salmacis and the Hermaphrodite, and Cadmus Sowing the Dragons Teeth.	What contains the paintings Apollo and Daphne?	the windowed wall
		His stay in Rome had been beneficial to his development, enabling him to incorporate into his own visual repertory the language of Luca Giordano and Baciccio.	What did Giovanni Antonio Pellegrini's stay in Rome enable him to incorporate into the language of Luca Giordano and Baciccio?	into his own visual repertory
		Toward the end of the seventeenth century, Cesare Alessandri, a wealthy Venetian merchant had a wing erected to the side of his villa, to be used as foresteria (guest quarters).	Where did toward the end of the seventeenth century have?	a wing erected to the side of his villa
04145-nieuwez0.jpg	In this picture the artist has painted Amsterdam on a flower-market day. On the right a line of sunny houses are typical of the style of Dutch middle-class homes. High and narrow and arranged over several floors, they have steep roofs against the rain and stepped gables. In the background is the Town Hall, which stands out from the rest through its monumentality, scale and style			
		High and narrow and arranged over several floors, they have steep roofs against the rain and stepped gables.	What stepped gables?	sunny houses
		In the background is the Town Hall, which stands out from the rest through its monumentality, scale and style	What does the Town Hall stand out from through its monumentality?	from the rest
		In the background is the Town Hall, which stands out from the rest through its monumentality, scale and style	What stands out from the rest through its monumentality?	the Town Hall
		High and narrow and arranged over several floors, they have steep roofs against the rain and stepped gables.	What do sunny houses have?	steep roofs against the rain
		On the right a line of sunny houses are typical of the style of Dutch middle-class homes.	What are a line of sunny houses typical of on the right?	of the style of Dutch middle-class homes
		On the right a line of sunny houses are typical of the style of Dutch middle-class homes.	What are a line of sunny houses typical of the style of Dutch middle-class homes on?	on the right
24734-presenta.jpg	According to an apocryphal life of Mary, her parents, Anna and Joachim, were not blessed with child for twenty years and when at last their daughter Miriam or Mary was born, they were so grateful to the Lord that they gave her into the care of the church and she became a virgin of the temple. These maidens were educated and received moral instruction from the priests, an arrangement which to some extent foreshadowed the orders of nuns in the Middle Ages. This painting by a Castilian artist - named after the place where his most important works may now be seen - records the moment when Mary takes leave of her parents and presents herself to the high priest. The artist's gift for depicting thoughts and feelings is clearly illustrated in the faces of Joachim and the high priest. His picture The Crucifixion, also in Budapest, suggests that the painter was an expressive artist, with a desire to convey the dramatic aspects of suffering; but this painting shows that he was also capable of lyricism and that even in his representation of saints he sought to express his knowledge of the human heart.			
		These maidens were educated and received moral instruction from the priests, an arrangement which to some extent foreshadowed the orders of nuns in the Middle Ages.	Who were received moral instruction from the priests which to some extent foreshadowed the orders of nuns in the Middle Ages?	these maidens
		This painting by a Castilian artist- named after the place where his most important works may now be seen- records the moment when Mary takes leave of her parents and presents herself to the high priest.	What records the moment when Mary takes leave of her parents and presents herself to the high priest?	this painting by a Castilian artist- named after the place where his most important works may now be seen-
		The artist's gift for depicting thoughts and feelings is clearly illustrated in the faces of Joachim and the high priest.	What is the artist's gift for depicting thoughts and feelings clearly illustrated in?	in the faces of Joachim and the high priest
		These maidens were educated and received moral instruction from the priests, an arrangement which to some extent foreshadowed the orders of nuns in the Middle Ages.	What were the priests?	an arrangement
		The artist's gift for depicting thoughts and feelings is clearly illustrated in the faces of Joachim and the high priest.	Whose gift for depicting thoughts and feelings is clearly illustrated in the faces of Joachim and the high priest?	the artist's gift for depicting thoughts and feelings
		These maidens were educated and received moral instruction from the priests, an arrangement which to some extent foreshadowed the orders of nuns in the Middle Ages.	Who were educated?	these maidens
10450-gregory.jpg	Gregory's Dialogues (4:40) tell of a monk from whom the last rites were withheld by his abbot because he was found to have hidden, three gold coins in his cell. By his prayers Gregory secured the release of the monk's soul from purgatory. Angels carry the monk's soul to heaven.The visionary and dramatic violence of the leading painter in the group known as the Seicento Lombardo places the episode connected with the mass into the background. Instead, all eyes are on the turbulent vision that links Purgatory in a spiral leading upward to the light of highest Heaven			
		The visionary and dramatic violence of the leading painter in the group known as the Seicento Lombardo places the episode connected with the mass into the background.	Who places the episode connected with the mass into the background?	the visionary and dramatic violence of the leading painter in the group known as the Seicento Lombardo
		The visionary and dramatic violence of the leading painter in the group known as the Seicento Lombardo places the episode connected with the mass into the background.	What does the visionary and dramatic violence of the leading painter in the group known as the Seicento Lombardo place the episode connected with the mass into?	into the background
		By his prayers Gregory secured the release of the monk's soul from purgatory.	Whose soul did Gregory secure the release of from purgatory by his prayers?	of the monk's soul
		By his prayers Gregory secured the release of the monk's soul from purgatory.	Who did Gregory secure the release of from purgatory by his prayers?	of the monk's soul
		Angels carry the monk's soul to heaven.	Who do Angels carry?	the monk's soul to heaven
		By his prayers Gregory secured the release of the monk's soul from purgatory.	Who secured the release of the monk's soul from purgatory by his prayers?	Gregory
38289-mohawk.jpg	Thayendanegea (1742-1807) was one of the seminal figures of early American history. The paramount war chief of the Iroquois Nation, as well as a missionary and diplomat of consummate skill, he was the Native American best known to Europeans of his generation. An inspirational leader, he lobbied tirelessly with both British and American authorities to secure his nation's survival			
		An inspirational leader, he lobbied tirelessly with both British and American authorities to secure his nation's survival	What did Thayendanegea lobby tirelessly with both British and American authorities to secure?	his nation's survival
		Thayendanegea was one of the seminal figures of early American history.	What was Thayendanegea?	one of the seminal figures of early American history
		An inspirational leader, he lobbied tirelessly with both British and American authorities to secure his nation's survival	What did Thayendanegea lobby tirelessly with to secure his nation's survival?	with both British and American authorities
		Thayendanegea was one of the seminal figures of early American history.	Who was one of the seminal figures of early American history?	Thayendanegea
		The paramount war chief of the Iroquois Nation, as well as a missionary and diplomat of consummate skill, he was the Native American best known to Europeans of his generation.	Who was the Native American best known to Europeans of his generation?	Thayendanegea
		An inspirational leader, he lobbied tirelessly with both British and American authorities to secure his nation's survival	Who lobbied tirelessly with both British and American authorities to secure his nation's survival?	Thayendanegea
04463-kitchen.jpg	In this well-stocked kitchen, in which the disciples Peter and John are keeping themselves busy, the preparation for the meal are dominated by two preoccupied cooks. Beuckelaer concentrated mainly on the convincing imitation of textures: textiles, vegetables, fruit, poultry and other foods. In his perfectionism he can be considered the forerunner of the 17th-century masters of still-life.In the background of the painting is the story of Christ in the house of Martha and Mary			
		In his perfectionism he can be considered the forerunner of the 17th-century masters of still-life.	Who can Beuckelaer be considered the forerunner of in his perfectionism?	of the 17th-century masters of still-life
		In this well-stocked kitchen, in which the disciples Peter and John are keeping themselves busy, the preparation for the meal are dominated by two preoccupied cooks.	Who are in the well-stocked kitchen keeping themselves busy?	the disciples Peter and John
		In his perfectionism he can be considered the forerunner of the 17th-century masters of still-life.	What can Beuckelaer be considered in his perfectionism?	the forerunner of the 17th-century masters of still-life
		In his perfectionism he can be considered the forerunner of the 17th-century masters of still-life.	What can Beuckelaer be considered the forerunner of the 17th-century masters of still-life in?	in his perfectionism
		In this well-stocked kitchen, in which the disciples Peter and John are keeping themselves busy, the preparation for the meal are dominated by two preoccupied cooks.	What are the disciples Peter and John in the well-stocked kitchen keeping busy?	themselves
		In this well-stocked kitchen, in which the disciples Peter and John are keeping themselves busy, the preparation for the meal are dominated by two preoccupied cooks.	What are the preparation for the meal dominated by two preoccupied cooks in?	in this well-stocked kitchen
04788-parisoen.jpg	Paris was the son of Priam, king of Troy. At his birth it was prophesied that he would bring ruin upon Troy. He was therefore left exposed to die on the slopes of Mt Ida, but was rescued and brought up by shepherds. He was loved by Oenone, a Naiad, or nymph of fountains and streams. But he deserted her for Helen, the Spartan queen, whom he forcibly carried off to Troy, thus bringing about the Troyan war and fulfilling the prophecy made at his birth.Paris in this painting points at the inscription he has carved in the bark of a tree. He holds Oenone's hand while she reads the words with him.The Paris and Oenone is one of three painting that bear Van Blommendael's mark. They show women of very similar features.			
		He was loved by Oenone, a Naiad, or nymph of fountains and streams.	Who was Paris loved by?	by Oenone, a Naiad, or nymph of fountains and streams
		Paris was the son of Priam, king of Troy.	Who was king of Troy?	Priam
		At his birth it was prophesied that he would bring ruin upon Troy.	What was prophesied that he would bring ruin upon Troy at his birth?	Paris
		Paris was the son of Priam, king of Troy.	What was Priam king of?	of Troy
		Paris in this painting points at the inscription he has carved in the bark of a tree.	What points at the inscription he has carved in the bark of a tree?	Paris in this painting
		He was therefore left exposed to die on the slopes of Mt Ida, but was rescued and brought up by shepherds.	Who was rescued?	he
31007-scaevola.jpg	"One of Venice's oldest patrician families, the Barbaro, commissioned a series of paintings depicting great figures from classical history and the Old Testament. Work in the Palazzo Barbaro on the Grand Canal stretched over half a century, involved more than half a dozen artists, and ultimately yielded nineteen canvases for three different rooms. Piazzetta's Mucius Scaevola is the third wall painting in the ""camerone.""The painting shows the strength of character exhibited by Mucius Scaevola by putting his hand into the fire"			
